utterance,hedge,L_context1,L_context2,R_context1,function,ID
had erm they had a really good band that they 'd seen busking somewhere and found out the name of them and got them up and they d sort of come on the train these four lads and they were really really good er and then sh my cousin surprised her husband her new husband,sort,PP,MD,VVN,pragmatic marker,S0326_2014
know the and they 're sort of yeah they 're not bitter not bi no or it 's like it 's not a question of you 're on holiday where they re sort of everyone s no s starving that 's true mm I mean mm one thing story is that when oh yeah when we went last year we sort of took a wrong turn,sort,PP,VBP,NN,pragmatic marker,S0326_2014
know they 've only just stopped killing each other yeah fairly recently well for the most part so I do n't know so yeah at first I sort of really resented this rule but mm it 's useful depending on the er group that you 're with yeah that 's true and I think you know if you 're,sort,JJ,NN,RB,pragmatic marker,S0326_2014
on the doorstep oh wow and now they 're getting to the stage where they 're they just ca n't stop cos mm they do n't know what the sort of repercussions will be are will there be repercussions if they stop ? erm oh so they 're giving through fear rather than through love yeah now,sort,WP,DT,NNS,propositional,S0326_2014
energy to do the lifting yeah erm whereas my previous trainer was just like no you 're n not eating enough you need to eat at least another sort of packet of rice on top of that mm and I was like explode so I do n't know well I suppose there 's carbs and there 's carbs yeah but he 's I 'd,sort,JJS,DT,NN,propositional,S0326_2014
him was because the tyrant was just sort of trying to get off with the with the younger one with the younger one but then there were sort of f f erm er sort of held up as erm sort of end ending tyranny and bringing democracy to Athens so it was sort of gift gi given er,sort,EX,VBD,NN,pragmatic marker,S0326_2014
so when she got to the cashier she was like oh I 've just forgotten some milk can you go and get me the milk ? er er you know er just to sort of make it sort of less awkward for her I suppose erm yeah but yeah that was er it just that would n't I just ca n't imagine that ever,sort,RB,TO,VV,pragmatic marker,S0326_2014
dude gets pregnant it 's like Eerie Indiana and it 's a bit like Roald Dahl a little bit erm kind of but not really but like in that IN really sort of family like ,sort,that,RB,NN,propositional,S0326_2014
existence of er sort of er these companies set like they just sort of build out of nowhere whole s towns but all they are is sort of factory and then places where people can sleep and then go back to work and people just sort of c come from the countryside and live,sort,VBP,VBZ,NN,pragmatic marker,S0326_2014
in school and just sort of shoving it in my bag looking at the mark shoving it in my bag not really looking at the feedback mm so I sort of think a lot of them are like that as well not all of them but some of them mm and I know the ones who are n't gonna give a shit what it,sort,IN,PP,VV,pragmatic marker,S0328_2014
know the business is run much more professionally yeah but you know during that era all these businesses were run by sort of were sort of family businesses and they were sort of you know just run into the ground were n't they ? yeah yeah and like the people who owned them used to,sort,IN,VBD,NN,pragmatic marker,S0328_2014
s what they said and that 's why er in England and Germany it 's not so much of a problem because there 's a huge disparity between this sort of these benefits and wages yeah whereas here it 's so similar that you can just swap one for the other yeah wow yeah so they said it 's so,sort,IN,DT,DT,propositional,S0328_2014
ferry do Rotterdam to where 's it go ? Harwich I think where 's that ? to where ? Harwich where 's Harwich ? east east of England sort of Felixstowe Ipswich mm kay uhu Suffolk sort of area we 've gotta be further north than that north of London mm mm erm yeah mm yeah so that 's,sort,IN,NP,NP,propositional,S0328_2014
off because I was doing everything right I was like describe right well I was eating right drinking right going to the gym being like sort of really positive mm and like we talked about this loads I was like in a really good frame of mind and I 'm just so annoyed that I feel like I 've,sort,VBG,IN,RB,pragmatic marker,S0328_2014
a big hug with him and he went home and told his wife that I was over so she came in and had a big hug oh nice erm and yeah people were just sort of wandering in bringing alcohol with them it was kind of nice really and then from number five I think sh she wandered in oh oh you 're back,sort,VBD,RB,VVG,pragmatic marker,S0328_2014
it 's it 's cool there basically and I knew about this thing from reading which is a really secret thing it 's called the erm it s sort of like the four hour walk up the mountain u up mount it 's a huge sort of cave like cliff face and it 's where erm because if you if you,sort,PP,VBZ,IN,pragmatic marker,S0328_2014
any sort of talking therapy is wonderful mm mm erm yeah these days I tend to talk to myself it seems to do the trick well I ve tried sort of asking a question and then kind of mind mapping it on a piece of paper with arrows and why why why why why why ? mm to try and sort of,sort,VHP,VVN,VVG,pragmatic marker,S0328_2014
kind of mind mapping it on a piece of paper with arrows and why why why why why why ? mm to try and sort of find a conclusion and I just sort of write all of this stuff and do n't find a conclusion yeah maybe there is no conclusion maybe the process is the healing yeah yeah,sort,PP,RB,VV,pragmatic marker,S0328_2014
I feel like I 've heard of it yeah it was on BBC over Christmas is it the one with ? oh god sort of your woman who was in Spooks ? yeah the sort of plain looking woman with brown hair and er dead Nicola thingy yeah and the gorgeous eyes either she 's dead or he 's dead she 's dead she 's,sort,RB,DT,JJ,propositional,S0331_2014
and this one 's good for when you get to the stripes okay cos it 's a V so it cuts nice oh did you cut yourself ? what did I say I just sort of like spiked myself yeah well oops same thing oh we have to start organizing that erm Christmas fair stuff oh yeah and I really do n't,sort,PP,RB,IN,pragmatic marker,S0331_2014
my two of my closest friends say we separately were economic Tories what ? they 're like we 're left no but but I do n't agree with the sort of welfare side of things oh my god it 's like what are you talking about ? erm it 's I do n't know yeah so and as I 've sa I think I 've said before,sort,IN,DT,NN,propositional,S0331_2014
about ? erm it 's I do n't know yeah so and as I 've sa I think I 've said before I mean we 've talked about this before you know you sort of lose touch with or you just presume everyone thinks the same as you because you surround yourselves with people who think the same,sort,VVP,PP,VV,pragmatic marker,S0331_2014
just feel so protective all the time if she ever left the house I 'd be worrying like what would happen to her er and you know well I sort of said but you know it 's not her responsibility to learn how to sort of er protect herself it should be sort of the responsibility of,sort,RB,PP,VVN,pragmatic marker,S0338_2014
cos I 'm not living you know it 's not a family home or I 'm not living here for years but I would n't be happy with like that level of sort of finish would you ? no no if this was like a you know long term home like for example if I I guess they 're maybe they 're like this is their,sort,NN,IN,NN,propositional,S0338_2014
her friends and she knows that she 's pretty and de de de and sort of for the first half of it you do n't really like her and you re not sort of very sympathetic towards her erm and she 's always going out and getting drunk er and sleeping around and then she 's er at a party and she 's,sort,VBP,RB,RB,pragmatic marker,S0339_2014
so I have to do my best and if I do n't and then my friend erm who was also applying we were both applying for our job yeah and erm she sort of like spent about half the time I did erm maybe even less yeah erm and what happened was that I came so that time that other woman got the,sort,VV,PP,IN,pragmatic marker,S0341_2014
so sweet and so nice and I just bullied him and I was like right you get a point every time you look at your partner and he was like doing sort of the quickest movements so he did n't have to look at the person sat next to him ah and I was like yeah they just need more social skills and,sort,IN,VVG,DT,pragmatic marker,S0349_2014
if you 're doing something would you say oh I 'm really not very good at this like as a preface like you know before you do it would you sort of give this disclaimer ? some people do yeah I tend not to hang around with people like that cos it just seems to me like a little bit of a,sort,MD,PP,VV,pragmatic marker,S0350_2014
types of intelligence these eight or nine different intelligence blah blah blah some of them are like well I think I I 've got this sort of scientific intelligence because da da da or I 've got personal intelligence because I 'm empathetic mm hm and he was like out of these ones I think I,sort,VVN,DT,JJ,propositional,S0354_2014
me of my crash in you know in that evening yeah oh my goodness erm and so uncle then helped him sort of pull it off of the road into sort of like a layby area with a hedge and everything right erm and then this other guy went and this lady went erm and they 're they 're,sort,NN,IN,IN,pragmatic marker,S0355_2014
uhu uhu like tattoos and cars to talk to him about mechanics and things like that so you know he was up for that but with her she just sort of wanted to sit and pout and put her cleavage on show which I just did n't really get mm hm no I did n't have either of them sadly I did have,sort,PP,RB,VVN,pragmatic marker,S0355_2014
of what attracted to me to that place is they 've got a picture they 've got a power place in their garden which presumably is some sort of lay lines type place but they 've sort of drawn out this grid in the land and sort of planted it into the landscaping mm hm er just,sort,VBZ,DT,JJ,propositional,S0361_2014
place in their garden which presumably is some sort of lay lines type place but they 've sort of drawn out this grid in the land and sort of planted it into the landscaping mm hm er just looks really cool yeah I think a lot of places I mean yes I do believe in earth energies,sort,NN,CC,VVN,pragmatic marker,S0364_2014
they did n't they had to make the case and I think the case has now been won that yeah more bats do die but er you just have live with this sort of thing erm yeah you can make a cage no no a case not a cage could make you could make cage yeah I 'm thinking but I think you 'd have to know,sort,IN,DT,NN,propositional,S0366_2014
a you know a berry yoghurt or whatever it 's called ? er yeah thanks mum that was really nice today thank you it was kind of in a sort of sausage and mash kind of way nice was n't it ? mm so well we 'll do then well obviously as well but I think actually you 'll probably come,sort,IN,DT,NN,propositional,S0367_2014
to being averse to going to Russia shut up who has to shut up ? why ? being pedantic pedantic no he was n't no shall I try and construct some sort of a what we would do in Italy thing ? okay yes cool see what we could what we cos I guess when you s when we say Italy what do you just,sort,VV,DT,DT,propositional,S0369_2014
houses are nice but they 're all like it 's pretty poor mm they 're not all the big posh houses mm that you get in they re all sort of quite yeah erm and yeah it 's that 's what it 's called god I 've got such a bad memory I 'm not gonna know where er nothing is when I go,sort,VBP,DT,RB,propositional,S0369_2014
Rhodes ? I do n't I do n't know if you saw it in Bristol but her father bought her a statue a quite a big statue right of a dog in sort of Edwardian dress no stand up stood up as a sort of a like a a gentlemen I can pi I can picture it some phone's ringing somewhere it 's your phone,sort,NN,IN,JJ,propositional,S0369_2014
bit are your tonsils ? I never know you can see them if you look down your throat and you can see them when they 're swollen cos they sort of like lift up I obviously ca n't look down my throat obviously then you try yeah you look in a mirror with a torch and you go and then you,sort,NN,PP,IN,pragmatic marker,S0369_2014
the VLE the virtual learning environment mm okay maybe maybe it was that er they use it a lot in universities it seemed like a sort of yes cos he was saying that you could carry on and using the my issue again with things like you 've got somebody coming for a week,sort,IN,DT,UH,propositional,S0370_2014
it was really oh really so it 's like a young playgroup ? no not a well they 're all toddlers they 're all about they re all sort of between a year and two and a half three ? cos yeah a couple that are siblings that come so there 's a couple of older erm kids that come,sort,VBP,DT,IN,propositional,S0382_2014
I agree with them yeah exactly that 's what I was thinking and she was saying that 's what all the research showed so they do sort of fairly modern yeah great stuff yeah she said there 's a few of them around who do it erm they all do it independently but quite often get,sort,PP,VVP,RB,pragmatic marker,S0382_2014
your friends are n't talking to us I think we tried oh no no I was like yeah at the start we did but then it 's like once you 've done the sort of oh you alright ? yeah it 's like you it 's very hard to sort of continue on that effort yeah but then cos said she was like no you know,sort,VVN,DT,UH,propositional,S0382_2014
always it 's just s happened why have they all of a sudden started falling out then or not being well a is they 've always had a sort of they they have n't fallen out just like I suppose she 's fed up this is your next mum this is your new mum she tried to er well she is she,sort,VHN,DT,PP,propositional,S0382_2014
just feels like it 's gonna yeah explode yeah yeah so I just like to sit in my own silence and erm yeah well it 's very good it s sort of like meditating in a way is n't it ? erm but it 's I do I love it it 's my way of yeah you know when I suffered with dep well I still do but not as,sort,PP,VBZ,IN,pragmatic marker,S0382_2014
yeah impossible right it was it was impossible it was n't just that some were geographers and some were economists and all that sort of thing it was just it was chalk cheese yeah apples pears apple pears yeah well the the funding body must have gone in with its eyes,sort,PDT,DT,NN,propositional,S0382_2014
then they were moved up higher that was the sort of how high would you go on that kind of I do n't think I material ? I I went any higher than sort of giving seventy-five er how how many seventy-fives did you give ? not possibly sort of er three or four perhaps ? okay not alright sort of okay,sort,JJR,IN,VVG,pragmatic marker,S0382_2014
started cutting down cos you know they 're either yeah they started cutting down into the trunk even then they left it and and they sort of grew big enough that 's they managed to survive yeah I know they 're horrible things are n't they ? was n't that the wood is the the,sort,CC,PP,VVN,pragmatic marker,S0383_2014
go down through the wills yeah you know cos er they all had to have wills and these little documents yeah so you can go back past this sort of this cut of point of whatev whenever it is mm yeah but it 's much more difficult mm and like when you consider most people do n't come,sort,IN,DT,DT,propositional,S0383_2014
I mean ? it 's just miniscule so like the yeah yeah the facial characteristics and like like you ca n't really no mm you ca n't really sort of go by that I mean to a certain extent you can because they 've probably got genes that do n't happen somewhere else you know but,sort,RB,RB,VV,pragmatic marker,S0383_2014
used to mm not having it I must say I 'm the sort of person would never have well she would n't switch a radio on no whereas I m the sort of person that mm you know as soon as I walk in the room you 're lost without it as soon as I walk in the room mm I 'll switch the radio on yeah,sort,VBP,DT,NN,propositional,S0383_2014
is yeah yeah sure fell out badly with her did she ? I did n't realise she only let on a few a little while ago yeah ? you know cos they were sort of like really good mates they were good mates yeah the only reason but apparently there were some some big argument going on about,sort,PP,VBD,IN,pragmatic marker,S0390_2014
I er no the thing is that them ones we had last time they did n't need no looking after no do they ? no whereas you get these these other sort of proper chickens they 're always getting like scabby legs and that 's right yes they are and something else is wrong and yeah mm you know and,sort,DT,JJ,JJ,propositional,S0391_2014
that way yeah probably the first electronic number one yeah probably yeah yeah well it 's strange is n't it when you think it s sort of like steps in yeah human invention yeah you know things what really changed the world and you know like I mean radio erm not radio,sort,PP,VBZ,JJ,pragmatic marker,S0391_2014
then they were talking about the impact on the kids and ho on how these kids with the mum who or the parents who never swear you know sort of gasp if they hear it on the TV yeah or you know it 's funny if people talk about it in the playground yeah and the others they just do,sort,PP,VVP,NN,pragmatic marker,S0392_2014
relaxing yeah sort of driving back you know and the time sort of totally wound up working by the time you got home again you re sort of like okay again you know yeah yeah and er but ai n't like that no she finds driving a you know sort of a chore yeah and she gets bored,sort,PP,VBP,VV,pragmatic marker,S0392_2014
is n't there ? they ca n't do it any more ? no oh no well was saying they 're trying to cut it down oh right and like the people who are sort of started it up and are keen on it I mean you 're talking about fifty thousand around the world yeah members of Wikipedia they sort of do,sort,WP,VBP,VVD,pragmatic marker,S0392_2014
who just sort of looks and thinks a bit oh I see looks roughly but what they do is like all the facts what they like to have is a some sort of reference right yeah cos of the cos everything on there has got a little number by it and then underneath is a massive great where this,sort,DT,DT,NN,propositional,S0392_2014
in putting the stuff on but you 'd definitely have something about in there oh oh that 's that 's that sounds and they re all sort of things all sorts of things yeah yeah Streetlife that you joined Streetlife at all ? oh god well that tells you lots of things there 's,sort,VBP,DT,NNS,propositional,S0392_2014
sides in yeah so they 're not damaged at all and you can that 's right yeah check them I mean I 've got a couple of little ones which are sort of flip books yeah you know them sort of smaller just sort A4 size and they 've got you know your flip you know yeah that 's it yeah yeah,sort,WDT,VBP,JJ,pragmatic marker,S0393_2014
them all on oh right and then so it had nothing to do with putting on erm so h we had two bars going across and then the the bike rack is sort of there s a long piece that goes and then your wheel slots in between two poles oh I see yeah in a special bit and then all it has is w a p a,sort,NN,VBZ,EX,pragmatic marker,S0402_2014
right ? and they stick it in your mouth and they said right bite on that and like mm like that and it goes everywhere and then then this sort of thing where they er oh I ca n't re quite remember how they do it where they leave it there for a couple of minutes gotta set has n't it ? to,sort,RB,DT,NN,propositional,S0415_2014
of mm shaped to clip on the bottom of your front teeth mm you know and then the sort of the plate sort of not very big plate but it sort of goes back and then there 's sort of it sort of clips on the back teeth and er you think well that ai n't very much you know but it just it,sort,CC,PP,VVZ,pragmatic marker,S0415_2014
could make and they they 'd go like this and they were two different people yeah when they 'd finished talking right they d just sort of go like that with their hands and then they 'd j could j j just gesticulate and mm yeah erm and when they walked you try I could n't,sort,MD,RB,NN,pragmatic marker,S0415_2014
n't it well er that 's right yeah but he were n't called that was his middle name yeah what are you looking at ? I just sort of noticed that sort of dome thing you got oh that 's a that 's a load of wood that a friend of ours dropped there oh yeah and er and he 's put a over the top of it,sort,VVN,DT,NN,propositional,S0415_2014
ago there was four things what he 'd got oh the other thing is he 'd bought this new mobile phone and signed up to you know sort er sort of the pretty fancy one cos he was fed up with his old phone and er he 'd paid for a contract for it and the bloody thing do n't work what ? it,sort,NN,NN,DT,pragmatic marker,S0415_2014
do and it goes past the erm er Olympic park does it ? yeah and stuff like that yeah so you can see all the Olympic park there mm and it sort of goes round there but what a brilliant road is it ? yeah and how much must that have cost to build ? well did they er destroys houses and,sort,CC,PP,VVZ,pragmatic marker,S0415_2014
you know how do you do that sort that out ? and he says oh we 're not really bothered about that mm you know there 's you know these sort of er airlock things yeah cos it 's like getting the bends getting the bends mm exactly yeah and you get these mm bone these er air,sort,VVP,DT,JJ,propositional,S0415_2014
d rather have the money I 'm sure well of course they would and of course what happened is oh forgotten about that and if you did sort of investigate it oh yeah well the deal went through and that ship is now in the Russian navy that 's right yeah yeah I mean there 's there 's so,sort,PP,VVD,VV,pragmatic marker,S0415_2014
which like never got repealed that 's right yeah like old rules and stuff like that yeah yeah which you could you could you know easily sort of bring up yeah you know and and they 'd say yeah no no it 's er well you just have a look on so and so you know rule like that 's right you,sort,VV,RB,VV,pragmatic marker,S0416_2014
do what this Wheeler Dealers thing is I mean you know it 's a bit artificial the actual set up yeah what they do is they buy an er a sort of a classic car not a vintage or but you know classic car sort of like a Hillman Imp or yes Lotus Elan or something they get a different,sort,NN,DT,DT,propositional,S0416_2014
to hold hers when she goes upstairs yeah and I do n't I I would n't I know I know mine are n't that big but it 's just like tops and stuff it makes it a lot harder mm cos you ca n't wear certain things cos like you have quite small boobs mm really like really small boobs they used to be bigger than this it was horrendous horrendous like I used to have like Ds really ? mm wow yeah all my family have like massive boobs what ? what happened ? like really s I dunno I just kinda  like I think I just sort of lost weight just like naturally lost a bit of weight and then you know it came off my boobs as well I suppose and now I can yeah goes off your boobs first yeah which is kind of annoying but log out here we if this became a regular thing though I could get so much clotheslike imagine that I I 'm kind of r wearing this like kind of thing so I just yeah see where I do n't like all the sparkly dresses mm erm just plain I have one lovely sparkly dress,kinda,PP,RB,IN,pragmatic marker,S0416_2014
tack up cos he 's like quite good to tack up and now because they do n't really tell him off like they do n't go like do n't bite he just sort of just does it now so naughty I watched a programme about erm saddles the other day in America yeah and an English saddle is worth a,sort,PP,RB,RB,pragmatic marker,S0416_2014
it 's Greenwich Mean Time but mm or British Summer Time they say yeah but the France do n't go back into well they there 's always this sort of gap of about two or three weeks is n't there yeah where they 're either one hour head or two hours ahead or something like that so,sort,RB,DT,NN,propositional,S0416_2014
all the beggars there were there yeah it was like veteran army blokes with no legs sitting there begging you know and they re sort of groping people and begging mm and he went and gave them some money not much and like there was people accosting him really ? telling him wh,sort,PP,VBP,VVG,pragmatic marker,S0416_2014
two helicopters who yeah when you see it they 're very s when they 're used it 's very seldom an emergency that 's right yeah they re sort of picking up people who you know mm seem bad but when they get there I mean my niece had a car accident and she sort of like shook and hurt,sort,PP,VBP,VVG,pragmatic marker,S0416_2014
ve got to find people who mm got the incentive to do it and and well the guy because nowadays you know they could you know with this sort of idea that that,sort,IN,DT,NN,propositional,S0416_2014
and that and we 're not we just want to meet mm you know and and talk like we did when we were kids well of course I mean the er this is sort of like nothing new about any of that is there ? no you know I mean people always have been wary of young people well yes but in in in in,sort,DT,VBZ,JJ,pragmatic marker,S0416_2014
it no and they 're sort of like adults they 're young adults yeah and sort of like they 've been there as young kids and mm they ve sort of grown and slowly sort of runned it until they sort of got cheesed off and went but they used to have all sorts of things going on in,sort,PP,VHP,JJ,pragmatic marker,S0416_2014
