utterance,hedge,L_context1,L_context2,R_context1,function,ID
left eye although I c actually I ca n't I do need the mirror but it would be to try I ca n't wink with my left eye anyway have you noticed those sort of Keep Calm and Carry On sort of ? yeah yeah mugs yeah er well and they ha do it for every sort of thing you can imagine it 's sort of like,sort,VVD,DT,NP,propositional,S0510_2014
for some dogs would it not make much difference em well the spaniels are sort of neither here nor there and collies are fairly sort of people dogs yeah I 'm just having an image of those blue napkins I was presented with the first time I went on holiday with your family,sort,VBP,RB,NNS,propositional,S0510_2014
do n't like bail oh you like have to sort of you turn yourself into a bondsman oh right so the guy 's like oh he 's he 's he 's regrets g sort of going to teach there and he 's on his hol going to s summer holidays he 's going to back to Sydney and he stops off in some town in the,sort,NNS,NN,VVG,pragmatic marker,S0510_2014
n't escape cos he 's c sort of gets does some gambling loses all his money he gets on goes on a sort of drinking but it 's like a really sort of straight square basically but within te like half an hour the outb outback town just like turns him crikey but the outback looks the,sort,DT,RB,JJ,propositional,S0510_2014
seen it in the theatre kind of like the Australians though they seem very straight forward well I I like and also I think they re sort of much less you know sort of there 's much more natural equality between the sectors it seems to me but but when you were saying that to,sort,PP,VBP,JJ,pragmatic marker,S0510_2014
of like the Australians though they seem very straight forward well I I like and also I think they 're sort of much less you know sort of there s much more natural equality between the sectors it seems to me but but when you were saying that to he was like I know but,sort,PP,VVP,EX,pragmatic marker,S0510_2014
to the those songs you will think about like in your life when you first heard them and stuff and they 've been in par like  s sort of got them all off the internet and I was like fourteen or whatever and listened to them but I do n't do n't have any attraction I think,sort,',JJ,VVD,pragmatic marker,S0510_2014
the barn still ? well I think it must do yeah it 's fairly steep down there yeah mm especially with all this rain they might get some kind of you do n't see the water running down though do you ? no no down the back the barn at all I do n't think should n't think so well they,kind,VV,DT,PP,propositional,S0510_2014
there 's er that there 's a h alternate tradition where there 's it 's Ste Stesichor Stesichorus er oh yeah erm he wrote he did a sort of poem where Helen never goes to Troy only a sort of an im an image of a phantom of her goes she spends the whole Trojan war in Egypt as a so,sort,VVD,DT,NN,propositional,S0510_2014
I 'm in I if you do have lunch what are you having ? I go to the hall I 'm gonna have the last bit of black lettuce I go the hall and I have sort of like roast duck or something yeah ? this is it has like truffles truffle risotto with starters then er like fennel and now if I got,sort,PP,VHP,JJ,pragmatic marker,S0510_2014
or something and just like left me with these girls I was like pretty feeling pretty relaxed and comfortable it 's like I m normally sort of open to like show people that I 'm friendly or like make friends if I want to and erm this chick was just not having a fucking she was,sort,VBP,RB,VV,pragmatic marker,S0510_2014
is that they thought that because everybody started becoming Christian it does n't really live for the here and now and they were sort of waiting to get to heaven so no one really cared yeah I mean production went down and they could n't fight for how long after they,sort,PP,VBD,VVG,pragmatic marker,S0510_2014
the hea the headlamp failed not the bike oh yeah ca n't see anything oh well what happened ? so how did you what did you do ? so we sort of spent like an hour and half going at five miles an hour ye oh trailing on this cliff side with the sea booming at the oh terrifying,sort,RB,PP,VVN,pragmatic marker,S0510_2014
in Rome like sort of pantomime and stuff that were going on but not really like grand like things like Aristophanes and Euripides are sort of really just like not you do n't you only get that at these at these festivals even yeah so he had to be probably be really subtle if he,sort,NP,VBP,RB,pragmatic marker,S0510_2014
and then everyone 's oh really ? so excited to be in like pleased with themselves included yeah to be invited that they 're willing to sort of do anythi or any of the weird initiation ceremonies oh n like what ? what do you have to do ? yes what are they ? there 's like all sor,sort,JJ,TO,VVP,pragmatic marker,S0510_2014
and that yeah love this and I 'm getting paid for it how good is life ? oh shit yes good sometimes I come out of lessons and I feel sort of realty happy yeah good er sometimes I do n't sometimes I just hate them Mondays my Monday class though is it 's getting better you said,sort,PP,VVP,NN,pragmatic marker,S0510_2014
are horrible and then eventually it kind of got really tired and sat on a on a a sort of quite low lying branch and then all the crows sort of rested on the top of the tree and took turns in like pecking it no I watched it for like an hour bit it 's and all and then the worst bit,sort,DT,NNS,VVN,pragmatic marker,S0511_2014
mm oh and then they surround it and and attack it that 's nature but it was so loud that 's nature all the squawking it was like a sort of Saturday afternoon as well yes oh really ? were there other people around on the park yeah ? but the by the sort of certain like maj like flying,sort,IN,DT,NP,propositional,S0511_2014
big dollar er yeah that 's about it we have n't got many other photos of it actually at the moment your erm I wa was wondering how to sort of regard your dart album on Facebook is it some sort of like conceptual art gallery just of the same shots over and over again ? there,sort,WRB,TO,NN,pragmatic marker,S0511_2014
it 's not cheap no it was actually started apparently by a a guy who started out er rummaging through dustbins and rubbish bins and sort of selling stuff or that kind of thing and er he just built it up built it up er and then but how would he how did he start it then ? well I I do n't,sort,NNS,CC,VVG,pragmatic marker,S0511_2014
so it 's just the way things are you know ? and er yeah you know the the young kids the they call them beurres in France which is always sort of a strange nickname for them cos beurre tran literally used to mean butter right but now the butters but why do they call them that ? I,sort,VBZ,RB,DT,pragmatic marker,S0511_2014
of money could be on standby of course so I might have t if I 'm unlucky I might have to wait around a bit oh what like t a couple of days sort of thing ? I do n't know n I I think normally they try and get you on the next flight you know if you ca n't get on so but if er if er chooses,sort,IN,NNS,NN,propositional,S0511_2014
I think he gives a bit of a you know people were f people liked him ? my mother hated him obviously oh of course yes but erm he was a sort of institutionalised institutional buffoon oh okay yes I understand Reginald Bosanquet I forgot to press the thing Reginald Bosanquet oh it has n't come out,sort,VBD,DT,VVN,propositional,S0511_2014
these ad er adverts did you not think that looks very old fashioned ? no cos it was n't then but but we did n't live our lives in this sort of half colour half I think you did we did n't all walk around talking like this to each other either did you not ? life was fairly normal,sort,IN,DT,DT,propositional,S0511_2014
her I mean thank god I have and on cos they more or less run the joint because I was dealing with and everything yeah you know all the sort of the mundane run of the mill things I do n't have to check up that they 've done it cos they do no you know they do yeah yeah it 's just been,sort,PDT,DT,DT,propositional,S0511_2014
of our time of our time in Peru but I do n't know if I 'm gonna have time why do n't you make him a scrapbook of all the since you met the sort of time scale from when we met yeah I could but I mean I 've got to find the time erm to go to get all the photos printed have n't I ? yeah well I,sort,VVD,DT,NN,propositional,S0511_2014
not having that door was a good help anyway yes have you seen some houses now where instead of having doors like this mm ? it they literally sort of roll back ? so the whole wall oh right no I have n't seen that goes back so you feel you 're sitting outside in your lounge yeah that 's,sort,PP,RB,NN,pragmatic marker,S0511_2014
yeah okay take care what were we saying ? er we were talking about these blooming diagnosis stuff that 's it ? yeah yeah you know they sort of plug into a computer programme they do yeah and they have this it 's the same they said something about how you know the one one one,sort,VVP,PP,NN,propositional,S0511_2014
it 's just there is n't a lot of room for it to come up but erm mm it it 's coming up mine was sore for years on and off yeah they they they sort of settle down and do nothing for a few weeks mm and then they suddenly start pushing again and it was oh several years before well this,sort,PP,PP,VV,pragmatic marker,S0511_2014
"smell on his breath just like you 'd been on spirits all night or whatever , any sort of you know , wine and it 's not a beer sort of smell . But I mean he 's I mean Ivan said to",sort,YCOM,DD,PPY,propositional,S0511_1994
steady whether it 's up or down exactly yeah but your mother 's the opposite she sort of gets slower and slower going up and then she sort of leaves me behind on the way down the other thing is erm er that we need to get our I need to go to email and we need to make our decisions,sort,RB,PP,VVZ,pragmatic marker,S0513_2014
your Minecraft that 's why but I because I had to pay for Minecraft anything really that you have to subscribe and pay for has a sort of password so did you you look at the new Aquilla magazine yesterday ? I did n't really have that much time to you did n't have much time,sort,VHZ,DT,NN,propositional,S0517_2014
pond the raised pond and a place to run around and activities to the code cracking thing from the Knights Templar and they had that sort of tray with mosaic tiles did n't they ? do you remember ? mm think so and was kind and gave you one of her tiles that she was playing with,sort,VHD,DT,NN,propositional,S0517_2014
getting there guys we 've not go very much to do I 've had a look by the way at the cinema and there 's nothing amazing on duh that s sort of cheap so maybe you might want to do that with dad or maybe we could just watch Harry Potter today Harry Potter ? harry Potter six are,sort,WDT,VBZ,JJ,pragmatic marker,S0517_2014
also purple ones and all sorts of different colours but he brought that one over and but the m made sure that that was the one that sort of took hold so that 's why we have but orange carrots the most erm the ones which are like here now are the red no the orange the purple,sort,CD,DT,VVD,propositional,S0517_2014
of being knowing what I was talking about you have to do n't you ? mm that 's what I hate about ' s erm er Samsung Galaxy Tab cos when I sort of say things like that she 'll say hang on a minute open this oh R one 0 one find out no it was n't built there and I 'll sort of go oh mm you,sort,WRB,PP,NN,pragmatic marker,S0517_2014
do ? yeah absolutely you know it 's what they 're being paid for is n't it ? yes it is I 'm gonna phone anyway because erm and ' s started to sort of say things and she never has before and she was telling me a story yesterday where a lad was giving her it 's the physics teacher,sort,VVD,TO,NN,pragmatic marker,S0517_2014
well the thing is I just think it 's a bit sad to be analysing it like that yeah cos the story has been there for a long time it s sort of a mythical thing is n't it ? so it 's a bit boring for everyone to go oh no we have n't found it because maybe there was a monster and maybe,sort,PP,VBZ,DT,pragmatic marker,S0517_2014
same colour they do they do do you know what ? when I bought them yeah they were supposed to only have one day in you know ? in so were sort of sell by the twenty-fourth or something yeah but they 're not like all open and they 're not no and they 're still to open up,sort,RB,VBD,NN,pragmatic marker,S0518_2014
they just swallow a spider but if I was going to do it I would have to chew and chew and chew because I would always think that it was sort of somehow alive in my stomach do n't you think ? it would be horrible would n't it ? mm but I could never do that in a million years actually,sort,PP,VBD,RB,pragmatic marker,S0521_2014
s also a film called The Boy in the Dress ah erm yeah The Boy in the Dress is basically a life story about David Walliams well it sort of is and he he c he likes boys and girls as a in fact so I think what I 'm asking you and we 're not really sure is if you know do you want to,sort,RB,PP,VBZ,pragmatic marker,S0522_2014
women automatically by law get er well it 's well over a month oh right off if their partner dies their husband yes well it s sort of sensible yeah dies and they 're supposed to shut themselves away yes just be in the house they can have visitors mm as many visitors as,sort,PP,VBZ,NN,pragmatic marker,S0523_2014
to entertain the people hanging around and there was lots of kids hanging around watching their parents and they were playing some sort of old-fashioned music and then the DJ said just to let you know it is going to be cheese hour in two minutes because when you get really naff music,sort,VVG,DT,JJ,propositional,S0523_2014
or no so that 's er Sicily or mm anywhere like that in a day no yeah that 's still good though yes yes and you you could have a different sort of holiday you could have stop off yeah stop off have different centres that you visit and as you make your progress to the furthest,sort,DT,JJ,NN,propositional,S0523_2014
? I think they are but I think I do suspect sometimes with comparison sites is one way that they make their money is to try and erm sort of do it by a ranking of which insurer has paid them the most to try and sort of broker a bargain like that yes really ? bit,sort,CC,NN,VV,pragmatic marker,S0523_2014
just separate publications yes yes obviously Mice and Men is an American based erm novel erm yes it 's basically focuses on the sort of the big dream attitude in America that was present in the I think it was the nineteen twenty thirties mm yeah thirties yeah that,sort,IN,DT,DT,propositional,S0523_2014
that happens all the time sir so yeah do you not want to have a word with your operatives ? yeah when you say operatives that sounds like sort of black ops you know yeah someone 's going to break into your house in a black balaclava and empty your bin out yeah they are called,sort,VVZ,IN,JJ,propositional,S0523_2014
and one thing and another because what one thing Churchill could do was talk and convince people and he could always come out with sort of some clich mm the punchline yeah was n't it ? yes he could always come out with things like that mm er and er but behind the sce he was n't,sort,RP,IN,DT,pragmatic marker,S0523_2014
I ca n't find my English one yes mm mm I 've erm bought a a new er cartridge for my printer oh yeah yes so uhu have n't been they seem to sort of risen in price a little bit but er I managed to get one for what I was sort of hoping to mm get it for was that ? yes it was mm mm mm it tends,sort,VVP,TO,VVN,pragmatic marker,S0523_2014
it cos she thought she 'd prefer the placements cos when she was at she just loved yeah being in the schools but now she s with sort of like-minded people and it 's notch up and all really passionate about the subject and she 's gained loads hey of confidence with getting that,sort,VBZ,IN,JJ,propositional,S0525_2014
of the computer ? big change yes to what now ? erm I do n't think it will we still meet everything ? I I think so well mm we ve got sort of two computers mm well even three computers and they 're all a slightly different yeah set up set up which mm I 'd be very surprised well it,sort,VHP,VVN,CD,pragmatic marker,S0525_2014
always get a seat do you ? no and you see them crowded are n't they some of them well yeah mm mm I would say that 's generally more the sort of region local and regional trains that yeah are more crowded because mm it 's Intercity or Eurostar it 's usually a reservation is,sort,RBR,DT,NN,propositional,S0525_2014
I said sound quite clear oh yes I said we 'll take them because if he does n't want them we can always bring them back we wo n't chuck them sort of thing like but er er and they were not all that old were they ? no and these terms and words you know posing in these questions mm you,sort,VV,PP,NN,propositional,S0525_2014
th but she said it was all calm but they did n't know that they were going there they no and then and even in the shower block there were sort of showers and they just said strip off cos you 're just going into the shower yeah awful you know oh it 's just yeah horrible it 's ju it 's I,sort,EX,VBD,NNS,pragmatic marker,S0525_2014
kinds of religions well that 's o that 's okay if that 's adopted that 's sort of to to so that you know you 're aware of all other s sort of religions but mm but on the other hand you know school you 're limited time for you 've got a limited time in school for for teaching kids I,sort,JJ,NN,NNS,propositional,S0525_2014
it on this website and you get like a hundred quid for it Ebay well yeah I suppose the only deals it you know and not only that like you sort of getting rid of it you 're getting money it 's not as yeah the person receiving it has no I mean I guess they in a way cos not only receiving,sort,IN,PP,VVG,pragmatic marker,S0529_2014
twelve minutes for this ? twelve minutes ah oh I 'm just trying to get my head round that so it 's just the way sort of it 's it s really sort of simple it s just the way you respond to something it 's the way you receive it yes but it 's in classics it 's interesting because,sort,VBZ,RB,NN,pragmatic marker,S0529_2014
it and look at it new and look at it new yes well I mean to some extent we do that anyhow do n't we ? yeah it 's it 's that 's why it s like sort of simple but yes I th I just think it 's a bit it 's helpful to think erm try and get into the mindset of of sort of Greek and Romans but it 's,sort,VBZ,IN,NN,pragmatic marker,S0529_2014
Bell yeah which is like a brilliant album erm and then they 've just kind of edited and rerecorded parts and make it a modern sort of Pink Floyd album that 's really exciting mm tempted tempted to buy that well think you think there 's pre-order when 's it out ? it 's,sort,DT,JJ,NP,propositional,S0529_2014
it but everyone agreed that it did n't taste like green which is quite worrying really I think we 'd all sort of had this break this sort of synaesthesia moment and we were like yeah it does n't but everyone everyone just agreed it should taste red it should be red it should have been,sort,NN,DT,NN,propositional,S0529_2014
follow mm really really heavy accent really peculiar grammar and and erm even I found it difficult so and erm you know my mum would sort of sit there smiling and nodding sometimes you know erm but er she grew oregano in her garden mm mm erm as possibly Italians will you,sort,NN,MD,NN,pragmatic marker,S0529_2014
? go as wear some stilts and go as yeah you could go as personal things you could go as pregnant this is not offensive these are the sort of things that ll end up being offensive yeah probably maybe not then erm what did people go as last year ? Miley Cyrus yeah you see that,sort,VBP,DT,NNS,propositional,S0529_2014
for you erm my friend er is just fin or he 's finished his journalism er masters whatever qualification it is and he was writing his sort of final piece on erm he was talking about graduates who have n't done graduate schemes they 've done something else mm so the first,sort,VVG,PPZ,JJ,propositional,S0529_2014
and were still like ca properly campaigning and then yeah do you remember when me and fell out and then no like you and were a bit sort of dodgy and yeah and me and were a bit a bit like oh yeah so we sat next and so we swapped and then that time we did the dinner party thing we,sort,DT,NN,JJ,pragmatic marker,S0529_2014
? is that the language ? mm do you so do you speak Maltese ? no we er er picked up odd words from going there because we 'd go there every sort of two or three years as children and you know you learn yes no hello goodbye yeah mm and then some of the erm the food where there is,sort,RB,DT,CD,propositional,S0529_2014
mm and you had the creamy colour mm stockings and the shorter skirt which took some manoeuvring and then I had a creamy t colour sort of slightly openwork jumper I used to wear mm tucked in mm you know and then and it was the era of the pale lipstick as well the mascara and the pale,sort,NN,NN,RB,pragmatic marker,S0529_2014
I mean in and the madness of it is is you when you drink you los the more you lose your self respect yeah it 's madness is n't it ? sort of weird psychology weird stuff especially if you remember everything you did or said oh thank god I do n't I mean I I yeah god terrible dr,sort,PP,SENT,JJ,propositional,S0529_2014
what 's the one ones that go in the water ? ca n't remember now m amphibians ? diplodocus ? sorry ? like diplodocus no but it looks sort of slightly like a diplodocus but the reason why they have these legends is because at some point they will 've seen you know the,sort,PP,VVZ,RB,pragmatic marker,S0529_2014
usually only if you 've had an accident yeah you break a rib and then it punctures your lung yeah but yeah supposedly tall and skinny sort of slim young girls get it and erm I do n't know it must be cause some must be to do with the everything is so tight in there I do n't know yeah,sort,CC,JJ,JJ,pragmatic marker,S0529_2014
closer to Cambridge yeah cos ' s so much into his music he ca n't find reliable like-minded musicians around mm those that he has sort of had conversations with and even some that he did form a band with briefly they were more Cambridge side yeah they were a lot closer to,sort,PP,VHZ,VHD,pragmatic marker,S0529_2014
that and what 's n the point of evolution and ? like philosophical thinking and stuff yeah I like I like thinking about all that sort of stuff and like yeah it 's good fun I have chats and w one of my mates is quite similar she does as well so whenever we get together we end,sort,PDT,DT,NN,propositional,S0529_2014
yeah yeah he said well we ca n't leave it there because er the cats 'll get it yeah or another bird will come along yeah yeah so I sort of poked just to see if it yeah was al cos it was still on its feet yeah it was just like fe there was feathers all around it yeah and I 'm like,sort,RB,PP,VVN,pragmatic marker,S0529_2014
deserve it so and he will meet the right one yeah does he like being in relationship do you reckon more ? yeah yeah he does he likes to sort of be secure and kind of thing ? he 's just yeah he erm you either are or you 're not are n't you ? I think he said he 's talking to a girl in in,sort,VVZ,IN,VB,pragmatic marker,S0529_2014
talking really about the clean nine they do a skincare range now and everything yeah mm but like they 're trying to get me to sort of like do more and more and I 'm like to be honest you know I 've got my own skincare range I do n't need anything else oh yeah no no that,sort,PP,TO,JJ,pragmatic marker,S0529_2014
we me we met up with oh that 's nice yeah they 've got very modern offices now yes but they used to have them in sort of street it was sort of solicitors' place mm now they 've got a m some very modern offices yeah just outside and I said they 've got about twenty-five staff there now,sort,PP,VBD,NNSZ,pragmatic marker,S0529_2014
always thought of Peterborough as a big city and the older I 've got I 've realised how little it actually is mm but when you get this sort of thing that s that makes us unique or puts us in not in the headlines but puts us in the news erm I get very excited mm yeah I think it 's,sort,VVP,DT,NN,propositional,S0529_2014
is a lot to be said for it is n't it ? because it you you it keeps your spirit going keeps you going oh definitely yeah yeah and even just sort of day-to-day you see that people people that you live with or that you work with mm mm mm you know you only need to say them what 's what 's got,sort,RB,RB,JJ,pragmatic marker,S0529_2014
and I was like what 's that ? and all of a sudden I heard de de de de and two things jumped on me they were like the cats and they they sort of looked like who are you ? who are you ? yeah cos that 's their room normally like the one they tend to do and like sit on the windowsill in,sort,PP,PP,VVN,pragmatic marker,S0530_2014
pull a face I wish I did n't pull faces you do actually it drives me I don I do n't want to be but it confuses the fecking cos you do kind of sometimes you put on faces that are completely contradicting your emotions which means that like you know ? people think you 're just,kind,PP,VVP,RB,pragmatic marker,S0530_2014
and we 'll put the vegetables out and nobody eats them apart from me and I would actually if you got me like if you got me some broccoli some sort of pure broccoli yeah I 'd make like a forest in there and make it all nice and avocado I like avocado oh in a wrap ? yeah all nicely mashed up,sort,NN,DT,JJ,propositional,S0530_2014
