utterance,hedge,L_context1,L_context2,R_context1,function,ID
"for that six weeks , to , to earn the money feed the And where can you get that bloody kind of money , only corner . Yeah , but where can you get a job . Well , that 's it . Where can",kind,DD1,JJ,NN1,propositional,PS007_1994
I know there 's slides cos Stephanie talks about them . Yes . She loves it ! And every kind of building brick and Duplo brick and Lego brick and Stickle brick and things . And plenty,kind,CC,AT1,NN1,propositional,PS01A_1994
"in the sense that people who like to go and see live music do n't people who like that kind of music prefer the dis prefer it in a Yeah . disco context . Yeah . Yeah . Not , not , seeing",kind,VV0,DD1,NN1,propositional,PS02G_1994
"they 're your So it like killed that . But I 'm sure there 's , I 'm sure there s that kind of trade for , you know , a sort of a Bic Biro runner type , you know , that kind of well our",kind,VBZ,DD1,NN1,propositional,PS02G_1994
"boy , Christopher , loves it but he 's a quiet child you see he thrives on that kind of thing . And she , he was always quiet when we were at the erm t twos to threes . And er",kind,II,DD1,NN1,propositional,PS02H_1994
"Rolled , what they call a rolled house . What on earth is a rolled house ? It s a kind of a , a type of mini greenhouse . greenhouses and frames er the prices ! Oh no no",kind,VBZ,AT1,AT1,propositional,PS02H_1994
", yes . Breakfast ah , no . Boiling hot . Ooh . Is it boiling hot ? No , it s just kind of warmish . Have you been to the toilet ? Yes no yes no yes no , no ? Come here . This is",kind,VBZ,JJ,JJ,pragmatic marker,PS02H_1994
not looking happy . Why did n't you want to buy the same one again mum ? Well I just kind of was running round the shop because I was You got the first one you could see . I had to go,kind,PPIS1,RR,VBDZ,pragmatic marker,PS03S_1994
not ? No . No . But them I 'm lucky to have have a job really . Well I mean these were the kind of jobs that were n't replaceable were n't they really ? Well In a slump . yes that 's it,kind,VBDR,AT,NN2,propositional,PS03S_1994
". I mean it 's not , it 's not the same kind of thing that we 've got , it 's a different kind of relationship cos he 's a different kind of person Yeah . but erm it 's good that he kept up",kind,AT1,JJ,NN1,propositional,PS03W_1994
"god they 've got a great big problem with Helena then and what kind of Oh no and what kind of words like different people use At the end of the tape you only get , I think you",kind,CC,DDQ,NN2,propositional,PS03W_1994
". The manufacturer said she was having the problem there . It 's only a small body kind of thing . what 're they gon na have to order ? Behind . She said , the part they were",kind,JJ,NN1,NN1,propositional,PS03W_1994
"it comes from . So she went with the architect and he was wanting to show us this kind of and we were like , were cold and were back to the hotel , we did n't even go into the",kind,PPIO2,DD1,CC,propositional,PS03W_1994
yeah that 's a good way to think about it you know whether that 's in language teaching or whatever it is yeah I still want that IN woohoo kind of a feeling of money I was like yeah me too yeah I work in publishing what do you expect ? yeah like no I 'm making no money yeah erm so yeah,kind,that,NN,DT,propositional,PS03W_2014
London ? oh I do n't know will you wanna move to London ? dunno depends on the job if I wanna do what I 'm probably gonna stay in the same kind of that field for now but it 's all technical and numbers and like I do n't know you mean you 'd want to move back to ? dunno but i they never,kind,DT,JJ,DT,propositional,PS03W_2014
"They make up the words themselves , right Yeah whereas Paul 's an the been having some kind of direction there , has n't he , I mean at Yeah . however nauseating , it does all make sense ,",kind,VHG,DD,NN1,propositional,PS03W_1994
"seem to be mainly , sort of , business programmes or alternative my one was , sort of , how to keep the customers happy . Doing the bus conductor , do you remember",sort,VBDZ,YCOM,YCOM,pragmatic marker,PS03W_1994
"it , the aim was to prevent AIDS no matter what you were doing , and not to have any kind of prejudice against what you were doing as long as the aim It 's also in support of the nuclear",kind,VHI,DD,NN1,propositional,PS03W_1994
"so , I said I think he 's , you know , I , I 've heard that , you know , he seems a quite sincere kind of bloke , he seems nice but I do n't know that 's what I think but if he What did Kirsty",kind,RG,JJ,NN1,propositional,PS03W_1994
"her cheeks . Hypocrite Charlotte . Yeah and Charlotte 's cheekbones seem to kind of descend from up , up by her temples as opposed to Are you all going ? Yeah . Apart from me .",kind,VV0,TO,VVI,pragmatic marker,PS03W_1994
"well then somebody else came and drove in behind me and the car in front then was sort of , oh yeah , then somebody else came and reversed in in front of him , so the car",sort,RT,VBDZ,YCOM,pragmatic marker,PS040_1994
bitter . Is she ? Why Well is she bitter ? well she 's had a miserable life of her own kind of thing . She 's not married ? Does n't like Sir Mark . Her husband left her . Oh . Does,kind,APPGE,DA,NN1,propositional,PS04U_1994
is . No one has ever said . Any more . On the rare occasion that it comes up she kind of laughs it off and says well it was n't really a marriage . And just change the,kind,RP,PPHS1,VVZ,pragmatic marker,PS04U_1994
". . when Angela 's form , I mentioned that and the woman says if you 're in any kind of forces , you are exempt . When I went in with Angela 's form Well they were because",kind,II,DD,NN2,propositional,PS04U_1994
we used to do well it 's like my pottery and things seed pods and cross-sections and all of that which was late sixties erm but it kind of had been and gone by the time you got to do yours probably well maybe and was n't considered it was n't considered a thing to do a,kind,CC,PP,VHD,pragmatic marker,PS04U_2014
January ? I do n't rea the things the place we walked round I do n't recall remembering any of it from that trip though well it is kind of a bit difficult to I mean it 's all kind of flat and looks the same really yeah d we did we go past the centre ? I do n't think they had,kind,PP,VBZ,DT,pragmatic marker,PS04U_2014
a feeling that you we had heated containers that you had your dinner out of or else they they put these on the table for the eight to kind of help themselves I suppose it was encouraging table manners oh I do n't know cos was always er keen to finish off the the tray mm mm the,kind,CD,IN,VV,pragmatic marker,PS04U_2014
going to go in town for shopping or yes you know you have to go right up road to get a range of shops all the shops they 're they re all kind of around there they 're all within not exactly walking distance because you 're not meant to walk around there really no but there 's a,kind,VBP,DT,RB,propositional,PS04U_2014
she used to make it mm but er did you see things in magazines or shops ? how did you get your ideas ? or did you just do them you did you kind of know what people had and make one up ? well I kind of saw bits of things I liked and made one up really mm erm cos I kn I well it 's the same,kind,VVD,PP,VV,pragmatic marker,PS04U_2014
nylon or am I rude about it ? with a printed erm well it 's kind of like that but it was had a slightly erm velvety but it it was a kind of stretchy material and it was like a erm a big T-shirt only not like they wear now that 's flappy with the off the shoulder it was erm a properly,kind,VBD,DT,JJ,propositional,PS04U_2014
they get lots and lots of layers of synthesiser and stuff in them and it can be it can be hard to replicate all that on stage yeah what kind of er ones are you doing nowadays from the from the charts ? er I do n't think we 're doing anything that 's terribly current erm when,kind,RB,WP,NN,propositional,PS04U_2014
no do n't worry I 've got them it 's fine so we worked through the night just putting stitching together some extra stuff that IN we kind of had in a lot of people are like oh so when are you going to move in together ? it 's like actually no we know that at some point we have,kind,that,PP,VHD,pragmatic marker,PS04U_2014
to the surface which it kind of does yeah then you 've got to integrate it but the book's kind of like yeah and the idea is that IN you kind of let it in the end yeah I 'm so sorry about that no no no I 'm just like I think it 's more I think it was like I said to you I was like I 'm so,kind,that,PP,VV,pragmatic marker,PS04U_2014
it was n't for the police or whatever to I know how he landed or anything oh yeah it 's quite cool though is n't it ? like quite iconic JJ IN kind of body lying that,kind,that,that,NN,propositional,PS04U_2014
cossie and we were all gutted so between us we managed to sort of find some big pants that were black and like a big erm vest thing NN IN sort of goes under at about nine and was like yeah I 'm good I 'm just and then I booked my train tickets cos they 'd I forgot I had to do it before I,sort,that,that,NNS,pragmatic marker,PS04U_2014
body you make your body do stuff that it does n't normally do yeah like we 're doing at the moment and it 's only afterwards that IN you sort of like get is n't it ? so it 's easier to like there 's more going on uhu and then it 's it 's easier to have it 's yeah and the shopping is,sort,that,PP,VV,pragmatic marker,PS04U_2014
"peeling , look , they 're all cracking up . Oh well , I 'm not surprised . You do , sort of , put them under wear and tear . I walk with them ! Oh dear ! I sprayed my hair ! I",sort,VD0,YCOM,YCOM,pragmatic marker,PS04Y_1994
and it was perfect for him being down the road from and the kids and having the flexibility to go and do it I mean I d I doubt he gets VVZ IN sort of flexibility with you know when you 're looking for so long and then if you do n't go you in the end you 're just gonna be well annoyed yeah but,sort,that,that,NN,propositional,PS051_2014
everybody I 'm generalising now cos I just said everybody that 's not true but erm a lot of people erm do n't like the fact that IN these sort of festivals you is rea I I did enjoy it but yeah I think as we did n't spend that much time in that many pla like that long and in that many,sort,that,DT,NNS,propositional,PS052_2014
less so every night he was waking up at the same time between four or five o ' clock really really bad pain like he was in labour NN IN sort of strength of know they 've just taken that on board erm I think some of the reactions have been positive I know that who ? oh sorry yeah,sort,that,that,NN,propositional,PS052_2014
yeah she she was on pay as you go and ten quid lasted her for a year oh wow and she never used her phone oh god okay yeah so yeah so she kind of messaged me be like oh you know we 've driven out to this random town hall in the middle of nowhere somewhere but it 's really pretty,kind,IN,PP,VVG,pragmatic marker,PS05B_2014
birthday cos I was a bit like oh yeah I was you know like I was saying to her oh I do n't want her to think that it 's all about me and I kind of want it and give her her presents and stu like that and what have you yeah but it 's like well no I 'm just like you know hey now oh that,kind,CC,PP,VV,pragmatic marker,PS05D_2014
it plainly I said look you know you 're gonna have to grow to like her one day cos she 's not going anywhere sure but also it s that kind of thing where you know it it 's that kind of thing where I said you do n't have to love each other no no no at all you just have to er respect,kind,VBZ,DT,NN,propositional,PS05X_2014
the side of it was just gross oh erm luckily yeah yeah yeah it wa cos I 've had concussion before but that was when I was a lot younger I kind of blacked out I did n't black out but I swear I must 've blacked out at some point yeah but lots of rugby players get concussion from like,kind,JJR,NN,VVN,pragmatic marker,PS05X_2014
cos obviously we 've got then we 've got two weeks in the middle mm then it 's and then it 's kind of that Christmas and it 's just that kind of thing I ca n't be saying to work that I 'm knackered and exhausted if you keep going away if it 's one week the next yeah the one after,kind,RB,DT,NN,propositional,PS05X_2014
him but then it 's kind of like well you know what ? like it was getting to the point where when when he got this job he was like and I kind of brought up the question I was like so how much is it you 'll be earning ? and it was ten grand more than me and I was like I do n't have a,kind,CC,PP,VVN,pragmatic marker,PS05X_2014
else but that that 's what I love about them that 's why my band 's like that because and also love them yeah that 's why it kind of works it really ? we all love them we all improvise loads live and not many other bands do that sort of thing so I think that 's the,kind,WRB,PP,NNS,propositional,PS05X_2014
use your finger he said and he got excluded for it yeah but she were like proper immature sort of teacher and because of it like they kind of let her off sort of thing but like it was n't like it was n't like she was being dirty or being weird she was just really stupid yeah,kind,VVP,PP,VV,pragmatic marker,PS05X_2014
Yeah . how come you 're back in ? It 's just different people are n't they ? Just sort of a bit Oh well so all we 've really got ta do now then is just get out and do a shop,sort,YQUE,RR,RR21,pragmatic marker,PS065_1994
like I was telling you earlier so I went into like economics and then there 's a literature section and a science section but it kind of put me off going through there because obviously you learn everything in detail in French and I there 's still stuff today that,kind,CC,PP,VV,pragmatic marker,PS065_2014
what ? it 's an actual bish ? yeah and it 's so ho like horrendous the bishop keels over what is it ? I ca n't remember he 's like well all sort of his about all his sort of like erm sort of sexual deviance in his youth and sort of it just gets worse and worse it 's like animals and I,sort,RB,DT,PPZ,propositional,PS066_2014
"had Joey the clown and Mr Nuttey , she said oh I 'd like them , but Sue said she went sort of a bit earlier and see how they got on and eh , she said oh it was n't the same at",sort,PPHS1,VVD,RR21,pragmatic marker,PS066_1994
and there have been times in my life when that 's a fantastic thing keep it rolling let 's go yeah yeah yeah but for the most part I kind of think actually no I do n't want to be in that scene yeah it 's not such fun I do n't know I kind of think drugs are better from that viewpoint,kind,NN,PP,VV,pragmatic marker,PS06A_2014
the first of February ? it 's a Monday okay well I have n't got any students on a Monday right so breakfast cherry liqueur no I I kind of think now all of my friends here in this country you know good friends do n't care if I 'm drunk or sober and the ones who want me to get,kind,NN,PP,VV,pragmatic marker,PS06F_2014
nice yeah and they both live in now teaching er she hates it and wants to move to the sunshine I can understand that bit er and he kind of likes it ah erm but they 're talking about moving sh cos she lived in Portugal before she moved here wow and she wants to go back to,kind,CC,PP,VVZ,pragmatic marker,PS087_2014
around the town yeah see my friends or whatever erm I 've gotta say Poland is n't easy no yeah erm it is if you think erm if you kind of get in your head nobody's thinking anything about me nobody 's judging me and once you get that in your head you 're fine you can,kind,IN,PP,VV,pragmatic marker,PS087_2014
out to overtake at the last possible minute and you get in again at the l yeah at the s the first available opportunity so you re kind of cutting vehicles up as you 're pulling in and you 're almost sometimes pulling out in front of people b but that is expected mm so you know I,kind,PP,VBP,VVG,pragmatic marker,PS087_2014
was skiing yesterday being right up at the top after we 'd uhu been up a few stair lifts and stair lifts ski lifts and erm yeah they kind of came out of the clouds mm and revealed themselves beautiful nice house all alone cold house house well do n't want to speak too,kind,RB,PP,VVD,pragmatic marker,PS087_2014
was one probably erm mm Bat Baratin what ? Baratin Baratin B A R A T I N this is too frozen maybe these are the new ones what is the place kind of an incredibly famous old one ? I do n't think le Baratin I think that 's only fa like famous in new famously rather right cos the woman in,kind,DT,NN,DT,pragmatic marker,PS087_2014
non-binary you 're not either if or you 're somewhere in between yeah or jus oh er binary yeah as in both I think we re all kind of both and neither yeah exactly yeah I mean you know physiologically speaking yeah most people can be defined by one or the other,kind,VBP,DT,DT,propositional,PS087_2014
it is an expression uhu whenever someone says it 's an idiom I think it 's an idiot I do n't know what knock it till you 've tried it kind of actually originally means what other weird phrases do we know ? erm my teachers said I was young once that 's not a weird phrase is that because,kind,VVN,PP,RB,pragmatic marker,PS087_2014
like come on they 're so heavy like literally yeah that yeah and the weights as well so he 's got those which the they look nice but kind of a bit impractical mm that yeah that would cost yeah yeah but I think they do like nice yeah but then you 'd need like quite a like a,kind,JJ,CC,DT,pragmatic marker,PS08A_2014
that means maybe it 's a the Polish is ? ? ? or ? maybe it 's what did you have with cabbage the other day ? the oh that was lovely that was kind of rice in yeah I know cabbage leaves in cabbage I do n't think it 'll be that with a tomato sauce no I do n't think it will I do n't think,kind,DT,VBD,NN,pragmatic marker,PS08Y_2014
more than look around me so I think there were probably about five at the back six seven eight plus the teacher okay all women all kind of thirty to sixty uhu teacher woman I 'm sure she 's older than me but oh my god what a body and how fit is she ? mm she 's amazing and the,kind,NNS,DT,CD,propositional,PS08Y_2014
tips for girls in the twenty-first century ? no I have n't right well my dad has what ? um and he felt the need to er we were in a restaurant and sort of after the third bottle of wine between the four of us um w we er he fell to discussing the fact that he 's recently found this,sort,NN,CC,IN,pragmatic marker,PS08Y_2014
reminds me um after lunch I 've got something to show you from work um I 've been doing a lot of electronics recently much to my sort of against my will but um I 've been doing all sorts and like I now know er my soldering has been improving no end and and crimping and what,sort,IN,PPZ,IN,pragmatic marker,PS090_2014
cooking is that they 're they 're more likely to kind of enjoy it if they 've made it themselves mm that 's what they say you know that kind of contributing to the process I 'm not quite sure about that if you do like it then it 's nicer if you 've made it but if you okay if it tastes,kind,VVP,DT,VVG,propositional,PS091_2014
one well they I was thinking they might have one allocated like erm like when you were at primary school there was a like your your kind of priest bloke who was n't you know he so he 's kind of comes in regularly but he 's not you know does n't live there or whatever of course he,kind,PPZ,PPZ,NN,propositional,PS09U_2014
then anyone else can and so the well the choices we 've got are really really really completely secure stuff like there s well kind of the where we 're ending up and that mm and also enables people to trade and do onliney stuff whereas if I did n't trust my phone to be,kind,VBZ,RB,NP,propositional,PS09V_2014
under compressed air conditions so er oh right and er because it was under the Thames right ? yeah course it they had er it was sort of all the air in there was compressed air yeah not much you know but it was er above atmospheric pressure yeah and I said to this guy,sort,PP,VBD,PDT,pragmatic marker,PS0A8_2014
young can you do it ? well is there an age ? ' s little sister does it and she 's like nine and she 's technically too young but she s kind of like knows what she 's doing cos all her family do archery as well well maybe cos all her face her family do archery as well yeah but,kind,PP,VBZ,JJ,pragmatic marker,PS0A8_2014
do lots of complicated tech work these are kids who like to stack shelves and so there were three of them erm making boxes where you kind of have to fold the boxes together and put the insert in and they 're all there and they were loving it absolutely loving it so a,kind,WRB,PP,VHP,pragmatic marker,PS0AA_2014
stupid the average person is right ? right and then just picture the fact that half of the people are more stupid than that it s kind of bad is n't it ? mm we all know where falls what ? are you being rude darling ? are you being rude ? no just pointing out how clever is,kind,PP,VBZ,JJ,pragmatic marker,PS0AA_2014
force yeah yeah and of course it then sucks all this other stuff in because it 's got such a high gravitational force yeah and it sort of all all the stuff collapses into this really really really dense centre which makes an even high greater force you know what I,sort,CC,PP,RB,pragmatic marker,PS0AC_2014
yoghurt or whatever it 's called ? er yeah thanks mum that was really nice today thank you it was kind of in a sort of sausage and mash kind of way nice was n't it ? mm so well we 'll do then well obviously as well but I think actually you 'll probably come round a bit can you,kind,CC,NN,NN,propositional,PS0AJ_2014
got deposed mm he has another run for presidency every five minutes though then the place is absolutely corrupt through and through kind of and there s the mafia to contend with do n't forget that mm to be fair actually er one of the things in the russian textbook is about,kind,CC,IN,CC,pragmatic marker,PS0AJ_2014
know j it was just to her friends and it kind of instantly went viral to like forty thousand people gosh and it 's a bit well it s kind of interesting she said she had like did n't really expect and anyway apparently the boy's got lots of erm offers to go for a coffee with him,kind,PP,VBZ,VVG,pragmatic marker,PS0BK_2014
sorry that 's alright shall I move it ? er yeah stir it move it erm yeah just turn er turning it so it 's slightly brown on all sides kind of looking like that looking like the picture oh do you have sugar ? yes I do erm brown or white ? er what do they say ? does n't say probably,kind,DT,NNS,VVG,pragmatic marker,PS0BL_2014
more mm which ? like if you had a morning like a for your morning one you 'd be more like erm the main in other schools in other schools I kind of get it because you have in other schools you 'll have three hours in the morning and an hour and a half in the afternoon whereas at,kind,NNS,PP,VV,pragmatic marker,PS0BL_2014
I ca n't find anywhere to put it mm and I remember that I do better and earn more points when I 'm looking at the board it 's not actually kind of relating it all together again I think I 've got the spelling right I wonder mm I 'm not sure spell and I 'm also not sure if it 's can I have,kind,RB,RB,VVG,pragmatic marker,PS0BY_2014
and I actually wish that I had gone and joined the erm the g can you not join it now ? yeah yeah I 'm sure I can yeah I do n't know I just kind of got a bit erm I did n't get bored of it cos they 're awesome just I got erm tired ? I do n't know a little bit sidetracked but a lot of,kind,PP,RB,VVD,pragmatic marker,PS0CG_2014
to get some face products yeah it was very exciting yeah so you should getting the perfect manicure and pedicure she 's like some kind of god of the good stuff for your skin yeah s beauty and motherhood oh yeah that 's the chapter I need to read you need to read this you,kind,IN,DT,NN,propositional,PS0CG_2014
gonna have you 're gonna have a celebration here as well are n't you ? either before or after ? yeah yeah yeah but basically I ve kind of said to people the first dilemma was when I was saying I really wanna go to Venice you know and if by the time I 'm forty if I have n't,kind,PP,VHP,VVN,pragmatic marker,PS0E8_2014
she probably asked too many just a yes or no concept questions yeah okay and something like that so I do n't know yeah but so she kind of said this is what I want to look at oh okay and did a little mini projecty thing on there then what did they say about action research,kind,RB,PP,VVD,pragmatic marker,PS0E8_2014
the managers there 's no reason why they should n't say you all have to do this this this mm and this yeah because if you thi it is kind of taking responsibility it saying we care what goes on what the managers and also taking responsibility ? makes it easier to a certain point for a,kind,PP,VBZ,VVG,pragmatic marker,PS0EB_2014
to deal with misconceptions for some really weird reason because yeah I do n't quite know why it works like that but it s kind of almost like saying tell me what you do n't know and tell me why you do n't know it 's it 's a really different way of learning it 's like a,kind,PP,VBZ,RB,pragmatic marker,PS0EC_2014
have by your sink yeah and they do hot water cold water or or boiling water instantly now how they do that that 's just must be some kind of special electri electricity thing they go through I do n't know okay if it 's a Hadron Collider spin off well I yes it could be yeah this is,kind,VB,DT,JJ,propositional,PS0FG_2014
a tearful Higgins yes was brought on with a chil brought on a child ? his his child was thrust into his arms you know it 's and that kind of thing and and this was in the Crucible on a sort of a bank holiday Monday that 's ri midnight or something like that you know smoke and,kind,CC,DT,NN,propositional,PS0FL_2014
